[
  {
    "id": "valspar-professional:interior-neutrals-7006-24",
    "displayName": "Ultra White",
    "manufacturer": "Valspar",
    "brand": "Valspar",
    "brandCode": "7006-24",
    "libraryType": "derived",
    "rgbHex": "#F8F8F3",
    "lab": {
      "l": 97.455,
      "a": -0.871,
      "b": 2.396
    },
    "source": {
      "kind": "derived",
      "url": "https://www.valspar.com/en/professionals/interior-neutrals",
      "notes": "Derived from the official Valspar professional page 'interior-neutrals' by matching linked official browse-colors entries to the canonical Valspar catalog."
    },
    "stockMatchable": true,
    "availabilityNotes": "Featured on the official Valspar professional curated page 'interior-neutrals'. Base color data comes from the official browse-colors catalog.",
    "aliases": [],
    "catalogOrder": 1,
    "active": true,
    "sourceConfidence": "high",
    "lastVerifiedAt": "2026-04-21T21:10:17Z",
    "regions": [
      "US"
    ],
    "tags": [
      "Popular",
      "White",
      "interior-neutrals",
      "palette:interior-neutrals",
      "professional-curated"
    ]
  },
  {
    "id": "valspar-professional:interior-neutrals-7002-16",
    "displayName": "Swiss Coffee",
    "manufacturer": "Valspar",
    "brand": "Valspar",
    "brandCode": "7002-16",
    "libraryType": "derived",
    "rgbHex": "#F1EFE7",
    "lab": {
      "l": 94.399,
      "a": -0.718,
      "b": 4.098
    },
    "source": {
      "kind": "derived",
      "url": "https://www.valspar.com/en/professionals/interior-neutrals",
      "notes": "Derived from the official Valspar professional page 'interior-neutrals' by matching linked official browse-colors entries to the canonical Valspar catalog."
    },
    "stockMatchable": true,
    "availabilityNotes": "Featured on the official Valspar professional curated page 'interior-neutrals'. Base color data comes from the official browse-colors catalog.",
    "aliases": [],
    "catalogOrder": 2,
    "active": true,
    "sourceConfidence": "high",
    "lastVerifiedAt": "2026-04-21T21:10:17Z",
    "regions": [
      "US"
    ],
    "tags": [
      "Popular",
      "White",
      "interior-neutrals",
      "palette:interior-neutrals",
      "professional-curated"
    ]
  },
  {
    "id": "valspar-professional:interior-neutrals-3003-10c",
    "displayName": "Cream in My Coffee",
    "manufacturer": "Valspar",
    "brand": "Valspar",
    "brandCode": "3003-10C",
    "libraryType": "derived",
    "rgbHex": "#E6DCCC",
    "lab": {
      "l": 88.146,
      "a": 0.736,
      "b": 9.077
    },
    "source": {
      "kind": "derived",
      "url": "https://www.valspar.com/en/professionals/interior-neutrals",
      "notes": "Derived from the official Valspar professional page 'interior-neutrals' by matching linked official browse-colors entries to the canonical Valspar catalog."
    },
    "stockMatchable": true,
    "availabilityNotes": "Featured on the official Valspar professional curated page 'interior-neutrals'. Base color data comes from the official browse-colors catalog.",
    "aliases": [],
    "catalogOrder": 3,
    "active": true,
    "sourceConfidence": "high",
    "lastVerifiedAt": "2026-04-21T21:10:17Z",
    "regions": [
      "US"
    ],
    "tags": [
      "Neutral",
      "The Classic Collection,Popular",
      "interior-neutrals",
      "palette:interior-neutrals",
      "professional-curated"
    ]
  },
  {
    "id": "valspar-professional:interior-neutrals-7002-20",
    "displayName": "Antique White",
    "manufacturer": "Valspar",
    "brand": "Valspar",
    "brandCode": "7002-20",
    "libraryType": "derived",
    "rgbHex": "#F0E6D8",
    "lab": {
      "l": 91.72,
      "a": 1.043,
      "b": 8.023
    },
    "source": {
      "kind": "derived",
      "url": "https://www.valspar.com/en/professionals/interior-neutrals",
      "notes": "Derived from the official Valspar professional page 'interior-neutrals' by matching linked official browse-colors entries to the canonical Valspar catalog."
    },
    "stockMatchable": true,
    "availabilityNotes": "Featured on the official Valspar professional curated page 'interior-neutrals'. Base color data comes from the official browse-colors catalog.",
    "aliases": [],
    "catalogOrder": 4,
    "active": true,
    "sourceConfidence": "high",
    "lastVerifiedAt": "2026-04-21T21:10:17Z",
    "regions": [
      "US"
    ],
    "tags": [
      "Popular",
      "White",
      "interior-neutrals",
      "palette:interior-neutrals",
      "professional-curated"
    ]
  },
  {
    "id": "valspar-professional:interior-neutrals-4003-1a",
    "displayName": "Seashell Gray",
    "manufacturer": "Valspar",
    "brand": "Valspar",
    "brandCode": "4003-1A",
    "libraryType": "derived",
    "rgbHex": "#DAD9D4",
    "lab": {
      "l": 86.645,
      "a": -0.549,
      "b": 2.577
    },
    "source": {
      "kind": "derived",
      "url": "https://www.valspar.com/en/professionals/interior-neutrals",
      "notes": "Derived from the official Valspar professional page 'interior-neutrals' by matching linked official browse-colors entries to the canonical Valspar catalog."
    },
    "stockMatchable": true,
    "availabilityNotes": "Featured on the official Valspar professional curated page 'interior-neutrals'. Base color data comes from the official browse-colors catalog.",
    "aliases": [],
    "catalogOrder": 5,
    "active": true,
    "sourceConfidence": "high",
    "lastVerifiedAt": "2026-04-21T21:10:17Z",
    "regions": [
      "US"
    ],
    "tags": [
      "Gray",
      "Popular",
      "interior-neutrals",
      "palette:interior-neutrals",
      "professional-curated"
    ]
  },
  {
    "id": "valspar-professional:interior-neutrals-4005-1b",
    "displayName": "Gravity",
    "manufacturer": "Valspar",
    "brand": "Valspar",
    "brandCode": "4005-1B",
    "libraryType": "derived",
    "rgbHex": "#C3C6C7",
    "lab": {
      "l": 79.678,
      "a": -0.846,
      "b": -0.861
    },
    "source": {
      "kind": "derived",
      "url": "https://www.valspar.com/en/professionals/interior-neutrals",
      "notes": "Derived from the official Valspar professional page 'interior-neutrals' by matching linked official browse-colors entries to the canonical Valspar catalog."
    },
    "stockMatchable": true,
    "availabilityNotes": "Featured on the official Valspar professional curated page 'interior-neutrals'. Base color data comes from the official browse-colors catalog.",
    "aliases": [],
    "catalogOrder": 6,
    "active": true,
    "sourceConfidence": "high",
    "lastVerifiedAt": "2026-04-21T21:10:17Z",
    "regions": [
      "US"
    ],
    "tags": [
      "Gray",
      "The Classic Collection,Popular",
      "interior-neutrals",
      "palette:interior-neutrals",
      "professional-curated"
    ]
  },
  {
    "id": "valspar-professional:exterior-color-combinations-7007-11",
    "displayName": "Antique Buff",
    "manufacturer": "Valspar",
    "brand": "Valspar",
    "brandCode": "7007-11",
    "libraryType": "derived",
    "rgbHex": "#E8DAC6",
    "lab": {
      "l": 87.668,
      "a": 1.533,
      "b": 11.569
    },
    "source": {
      "kind": "derived",
      "url": "https://www.valspar.com/en/professionals/exterior-color-combinations",
      "notes": "Derived from the official Valspar professional page 'exterior-color-combinations' by matching linked official browse-colors entries to the canonical Valspar catalog."
    },
    "stockMatchable": true,
    "availabilityNotes": "Featured on the official Valspar professional curated page 'exterior-color-combinations'. Base color data comes from the official browse-colors catalog.",
    "aliases": [],
    "catalogOrder": 1,
    "active": true,
    "sourceConfidence": "high",
    "lastVerifiedAt": "2026-04-21T21:10:17Z",
    "regions": [
      "US"
    ],
    "tags": [
      "Yellow",
      "exterior-color-combinations",
      "palette:exterior-color-combinations",
      "professional-curated"
    ]
  },
  {
    "id": "valspar-professional:exterior-color-combinations-4006-2a",
    "displayName": "Elephant Gray",
    "manufacturer": "Valspar",
    "brand": "Valspar",
    "brandCode": "4006-2A",
    "libraryType": "derived",
    "rgbHex": "#727A80",
    "lab": {
      "l": 50.751,
      "a": -1.686,
      "b": -4.296
    },
    "source": {
      "kind": "derived",
      "url": "https://www.valspar.com/en/professionals/exterior-color-combinations",
      "notes": "Derived from the official Valspar professional page 'exterior-color-combinations' by matching linked official browse-colors entries to the canonical Valspar catalog."
    },
    "stockMatchable": true,
    "availabilityNotes": "Featured on the official Valspar professional curated page 'exterior-color-combinations'. Base color data comes from the official browse-colors catalog.",
    "aliases": [],
    "catalogOrder": 2,
    "active": true,
    "sourceConfidence": "high",
    "lastVerifiedAt": "2026-04-21T21:10:17Z",
    "regions": [
      "US"
    ],
    "tags": [
      "Gray",
      "exterior-color-combinations",
      "palette:exterior-color-combinations",
      "professional-curated"
    ]
  },
  {
    "id": "valspar-professional:exterior-color-combinations-7007-4",
    "displayName": "Crisp Cotton",
    "manufacturer": "Valspar",
    "brand": "Valspar",
    "brandCode": "7007-4",
    "libraryType": "derived",
    "rgbHex": "#F4EFE7",
    "lab": {
      "l": 94.626,
      "a": 0.302,
      "b": 4.455
    },
    "source": {
      "kind": "derived",
      "url": "https://www.valspar.com/en/professionals/exterior-color-combinations",
      "notes": "Derived from the official Valspar professional page 'exterior-color-combinations' by matching linked official browse-colors entries to the canonical Valspar catalog."
    },
    "stockMatchable": true,